,titles,descriptions,links,site_name
4,Twee extra steunmaatregelen voor bedrijven,Twee extra steunmaatregelen van start voor kleine bedrijven in Brabant.,https://www.brabant.nl/actueel/nieuws/economie-en-werk/2020/twee-extra-steunmaatregelen-voor-bedrijven,www.brabant.nl
5,Brabant presenteert een nieuwe coalitie,"VVD, Forum voor Democratie, CDA en Lokaal Brabant gaan hun nieuwe coalitieakkoord presenteren.",https://www.brabant.nl/actueel/nieuws/bestuur/2020/brabant-presenteert-een-nieuwe-coalitie,www.brabant.nl
6,Natuurherstel Natte Natuurparel Kromhurken,Doel van het herstelplan voor Kromhurken is om de zeldzame habitattypen te behouden en te stimuleren. ,https://www.brabant.nl/actueel/nieuws/aanpak-stikstof/2020/natuurherstel-natte-natuurparel-kromhurken,www.brabant.nl
7,Provincie wil lening verstrekken aan Enexis,Gedeputeerde Staten willen een lening van € 150 miljoen verstrekken aan regionaal netbeheerder Enexis.,https://www.brabant.nl/actueel/nieuws/bestuur/2020/provincie-wil-lening-verstrekken-aan-enexis,www.brabant.nl
8,La Vuelta start definitief niet in Nederland dit jaar,Organisatie onderzoekt opties voor 2022.,https://www.brabant.nl/actueel/nieuws/bestuur/2020/la-vuelta-start-definitief-niet-in-nederland-dit-jaar,www.brabant.nl
9,Brabant investeert in monumenten en molens,Vouchers voor herbestemming van monumenten en eco-archeologisch onderzoek.,https://www.brabant.nl/actueel/nieuws/kunst-cultuur-en-erfgoed/2020/brabant-investeert-in-monumenten-en-molens,www.brabant.nl
